<?xml version="1.0" encoding="UTF-8"?>
<s:sklep xmlns:s="http://www.vavatech.pl/sklep" xmlns:xsi="http://www.w3.org/2001/XMLSchema-instance" xsi:schemaLocation="http://www.vavatech.pl/sklep sklep.xsd ">
  <s:towar id="2">
    <s:nazwa>Pralka</s:nazwa>
    <s:cena>1999</s:cena>
    <s:vat>23</s:vat>
    <s:opis>Opis pralki</s:opis>
  </s:towar>

  <s:towar id="7">
    <s:nazwa>Odkurzacz</s:nazwa>
    <s:cena>349</s:cena>
    <s:vat>23</s:vat>
    <s:opis>Opis okurzacza</s:opis>
  </s:towar>
</s:sklep>
